post,label
"#Дуйсбург Четверо арабских беженцев зарезали немецкую девочку-подростка на 5-м месяце беременности, которая думала, что она… @url",1
"@user говорит, что левый. когда получает угрозы от крайне левых и видит миллионы повреждений и… @url",0
@user @user @user @user @user как вести дебаты между левыми без каких-либо противоречий,0
Греция: поток беженцев и мигрантов на континент ускоряется @url @url,1
"@user Я не думал об этом, но немногие жители Северной Африки столкнулись с африканскими #мигрантами в Нанте.",0
"@user @user @user не голосует, отдает голос левому макрону слева и т. д.",0
когда вдобавок социальное насилие (потеря… @url,0
"@user @user @user никто не зацикливается на том, что у многих из них в пищеводе земноводные?",0
"@user Я не опаздываю на станцию, но снаружи звонят отовсюду.",0
"против иммиграции и исламизации Франции единственная партия, которая защищает Францию, - это RN (и DLF) @url",1
@используйте деньги для мигрантов... деньги... прежде всего французский! для наших пожилых людей – национальный приоритет!,0
Лун-Бич: женщина подверглась жестокому нападению со стороны группы мигрантов @url,0
"что об этом думают сторонники агрохимии, сторонники развития, чрезмерно антиэкологи и другие климатические скептики… @url",1
многие мигранты также жили нелегально в США. 35% нелегальных мигрантов перехватываются в Квебеке… @url,0
"@user арабские страны просто должны приветствовать их, мы не хотим этого так сильно",0
Макрон и исламизация Франции — хорошо продуманный план института Монтеня @url,0
"@user для меня незначительность не заслуживает того, чтобы на ней заострять внимание !!",0
"видео Газа: так СМИ называют демонстрации. а по-вашему, почему арабы посылают… @url",0
"Ренуа — городские парни, которые бегут как мбаппе, как только тебя узнает собака #thiseventribunal",1
в моей команде в университете clrmt 20 ребе/ренуа на 600 с горяч.,0
"ну, есть еще несколько очень красивых предложений, если присмотреться немного @user @url",0
"@user @user чем именно занимается это правительство? почему он зацикливается на мелочах, когда… @url",0
"@user да, но с утра я не опаздывал после матча",0
"представить, что #африканцы приезжают в #Европу — это просто фантазия, учитывая, что 90% африканских #мигрантов возвращаются… @url",1
"@user @user @user мистер Саймон, вы не можете оправдать или смягчить жестокость высказываний мистера Земму… @url",0
"@user, это совершенно так, попробуй уже произнести это по телевизору, и ты увидишь, что это немного похоже на левое выражение",1
@user @user птн это насилие над вопросом лол,0
@user у этого умственно отсталого человека нет даже диплома. отдайте свою работу безработному.,1
к сожалению во #франции один из десяти потерянных найден! #мигранты #стопиммиграция @url,1
"для тех, кто сомневается в конспиративности и бредовом антисионизме Абдельрахима Али, вот тема… @url",0
"если #заговор и #антисемитские убийства в #питтсбурге сегодня обрушатся на #США, давайте не будем забывать, что этот идеал… @url",1
ты бы предпочел пойти на вечеринку с другим идиотом из зоонекинда или пойти на занятия с другим монголом из Маье? — Алекс… @url,0
"@user, почему против аутистов? Я считаю глупым делать это чем-то вроде обязательной вещи, но… @url",0
@user @user @user @user просто я обычно больше внимания уделяю цвету своей одежды,0
положить конец теории заговора против автомобилей @user @user @url,0
интересная левая диалектика.,0
"@user @user @user это было бы: антиисламизм (антирадикализм, терроризм, экстремизм) или анти я… @url",0
"@user да, очень хорошо! но я до сих пор не вижу корреляции с африканскими мигрантами. ^^",0
"@user ptydttyddtrrtdd вау, ты принимаешь меня за грязного араба",1
веганы против абортов?,1
@url @url @url ты говоришь чертовски левый @url,0
"@user @user @user guenolé, левый осмелился критиковать одну из единственных по-настоящему благородных феминисток и… @url",0
"новый поворот влево, ПС вернулся в оппозицию. после голландского мандата… приветствуя мигрантов… @url",0
"Ренуа, это безумие, как они сдают аренду, особенно когда они носят durag jvs love",0
"Я действительно отсталый, ням",0
"Как вы физически находите повстанцев? не обязательно парни Тесс — сумасшедшие, сумасшедшие @url",0
"@user сказал бы, что это большой вест-индийский дарон на последнем",0
Бог никогда не медлит с удовлетворением внешней потребности.,0
Алжир: «мигранты сейчас гораздо более уязвимы» для Лейлы Беррато - @url,0
"забывает слова, конечно, больший дебил, чем я х)",0
"@user, этот интеллектуальный терроризм характерен только для левых; история это продемонстрировала и до сих пор показывает.",1
"@user, это насилие, продуктом которого ты являешься?",0
Италия принимает закон об ускорении высылки мигрантов @url,0
"@user @user чувак, если он не выиграет у «Ливерпуля», его выбьют, так что не отставай здесь",0
скорее это левые коллаборационисты из-за них отвернули глаза своим бедолагам mi @url,1
"@user, они считают его умственно отсталым или типа того, ptdr",0
"когда я выхожу из парикмахерской, я действительно самый красивый из всех ребе",0
расистские антимусульманские террористические атаки; редко квалифицируются как терроризм. https:…,0
"@user @user Вы имеете в виду, что подозреваете @user в пропаганде исламского терроризма? и… @url",0
"как он ставит свою фазу на «ле Ренуа де Стэмфорд Бридж», если он берет кого-нибудь в Леуле",0
"@user @user Я не отрицаю, кто я, я ем все. Я бы съел левое бобо, но я… @url",1
"@user @user йен, у них проблемы с получением, это безумие",0
он способен под воздействием гнева первой степени бросить на тебя грязного араба или грязного негра... У меня есть… @url,1
"когда я вижу, что котенок помогает детям-беженцам, которые спят на улице...",0
"«Чтобы снизить издержки преувеличенной иммиграции, чтобы быстрее высылать правонарушителей и поддельные заявления… @url",1
"rt @user все друзья Клары называют меня твоим китайским другом лол с уф г не чувствую, что я так сильно похож на нойча q",1
@user @user нет! не нужны эти экономические мигранты! хватит значит хватит . более срочно нужно… @url,0
"Арабов тоже много, и они так редко появляются в моих кругах, что вопрос…",0
"Исламистские предпочтения левых мотивированы клиентелизмом, но также и антиклерикализмом.",0
"@use африканизация и исламизация Европы - это импорт моральных ценностей, которые связаны между собой. н… @url",1
невыносимо the rebeus pr ca @url,0
"@user @user идет исламизация Франции... финансируется кафе. это, наверное, первый… @url",0
"@user @user @user @user уже ислам= мирный терроризм — это средство, которое он использует… @url",0
"@user Я не левый, как ты говоришь. Меня никогда не считали левым. ты... @url",0
Антимигрантская стена в Сахаре: потрясающая идея Трампа @url,0
"@user @user Мне хотелось бы знать, почему «левый ислам» — ваш главный враг и… @url",0
"@user @user да, большой замены или антибелого расизма не существует! c tjr арабская черная молодая в с… @url",0
"У меня есть одно сожаление, но я не буду на нем останавливаться. надо двигаться вперед @url",0
#мигранты #ислам #исламизация #исламизм #ислам #африка #иммигранты #макрон #лрем #фра…,0
"@user @user Баас была партией для всех арабов, имевшей свой вариант в каждой стране (иракская Баас при Саддаме и т. д.)",0
"@user это не та группа сторонников, что ты монгол",0
"@user @user это не имеет ничего общего с тем, чтобы быть на вершине пищевой шкалы или с нашим... @url",0
@user @user «мы во Франции».... «мы не в Африке» твои слова вызывают смех… @url,1
"@user @user хорошая шутка. Арабско-мусульманское рабство, терроризм и исламизм уже нанесли немалый ущерб.",1
@user @user @user всегда одни и те же клише 1) ненасилие – это моральная позиция… @url,0
"вверху: @user 'добро пожаловать в #cergy, где совершенно обнаженные африканские мигранты жестоко нападают на французов… @url",1
"@user @user @user @user в Индии не ест мясо, потому что из него получается г... @url",0
"@user me hamdullah Я живу в африканской стране, поэтому мое имя не будет беспокоить, но людей, у которых есть трудности… @url",0
"@user Я пошел к своему оператору, они сказали мне, что я ничего не могу сделать, кроме как подать жалобу на притеснение или изменить свой номер",0
"@user @user ты узнаешь разницу между левыми, такими как lula/melenchon, и f... @url",0
"Ренуа, ты не можешь сказать ей, что она тебе нравится, иначе ты найдешь ее красивой, иначе в ее голове она поверит этим бей… @url",1
включение разнообразия не означает молчаливого согласия с мракобесием. отказываясь осудить политический ислам… @url,0
"как ни странно, меня оскорбляют только ренуа, они самые большие шлюхи во вселенной? ржу не могу",1
"@user @user ну, ты тоже скажешь тебе переконвертировать, когда по причине x или группе d... @url",0
«грязный еврей» выделен непохожим на остальных лол #lejouroujaibrulemoncoeur,1
"@user должен переопределить это. У меня то же самое, я не обращаю на это особого внимания...",0
"Левая идеологическая обработка @user работает на полную мощность на клише, разворовывает их богатство на... @url",0
"@user @user не должен мечтать о том, что кто-то опоздает в пятницу... надо приложить немного усилий... @url",0
"@используйте особенно арабов. Они идеально подходят для занятий спортом, к тому же любят ветер благодаря своим… @url",1
"@user hsksjsh да, почему бы и нет, но эй, Ренуа третьи в моем рейтинге",0
"@user @user ах, это сложно, когда знаешь, что смартфоны — это бетон и здания",0
"@user @user истребляй, чтобы не мучить их. это напоминает нам о второй мировой войне",0
"@user Я признаю, что мы слишком сильно страдаем от студентов Ренна. силы вам вместе!!! @url",0
"@user, особенно чернокожие и арабы, в худшем случае у них будет интервью, но когда парень увидит их лицо в этом м… @url",0
"Чтобы считаться активистом по борьбе с расизмом, вам нужно сделать только две вещи:",0
"она разговаривала со своим другом и сказала ему, что он ренуа.. ах… @url",0
"Французские левые хотят решить мировые проблемы, но не могут решить проблемы дома...донор @url",0
"@user @user @user @user @user просто левый, всегда дающий уроки морали",0
"Если бы Земмур сказал правду, что терроризм утверждает, что это ислам, он бы не смог закончить свое предложение. onpc ложится спать… @url",0
"трахни твою мать, грязный еврей @url",1
"когда степь слишком велика, ветер несет новости монгольской пословицы, датируемой еще до Твиттера....",0
"@user @user @user нет, но левые очень долго идут на компромисс...",0
Ренуа и их потоки - такое удовольствие для глаз :)),0
@user @user отрицание антибелого расизма исламо-левых @user тот же аргумент… @url,1
"@user @user @user Ислам строго запрещает терроризм. те, кто знает историю… @url",0
Торты ребеус: шаг 1 @url,1
"@user @user @user конец игры Я не задерживаюсь с людьми, которые говорят, не зная, благодаря г… @url",0
"Сенатор Пийон выступает против абортов, против однополых браков, против разводов и против алиментов… @url",1
Нет ! не нужны эти экономические мигранты! хватит значит хватит . срочно навязать др… @url,0
"ты развлечение ребеу, грязная девчонка знает, что тебе нравятся арабы — всегда в поисках малейшего из моих твитов, ты… @url",0
@user @user Исламизация на подходе! широко распространенная нищета по всей Франции.,1
"ребеус, которого я не знаю из Евы или Адама (да, старое выражение), перестаньте добавлять на Facebook, это не останавливает… @url",1
"@user да, я хороший, я не зацикливаюсь на физическом плане",0
@user @user @user @user @user большой Мне надоело смотреть на Ренуа… @url,0
Исламизация Франции в полном разгаре – результат проникновения мусульман в слои… @url,0
"ваш Ренуа ростом 1 м 95 и весом 110 кг, который публикует фруктовые твиты, сказал бы «макасси»",0
"фильм об отсталых девчонках, которые каждое утро расправляются",0
"@user @user это не теория заговора. возможно, его захватили фашисты, но ЕС… @url",0
@user @user @user хороший левый друг Тихиро,0
"qué mongol, этот немец бежит на Елисейские поля вместо того, чтобы оставаться перед клетками",0
когда арабские эксперты проливают свет на ислам 20-го века > во главе с #Саудовской Аравией + очищение Мекки новый… @url,0
@user ptdrrr спасибо левый преф,0
@user @user @user ну точно,0
никакой исламизации Франции нет.,1
"@user Прошу вас заблокировать украденные у африканцев деньги, которые спрятаны в ваших банках… @url",0
"умственно отсталый из Меделина, который убивает спичку",0
"он говорит это, подчеркивая при этом словарь отсталых левых, который окружал нас столько лет.",0
"мигранты не зарабатывают/получают от государства больше, чем п… @url",0
"@user @user Ислам одобряет терроризм и не противостоит ему, то, что делает ИГИЛ, абсолютно не э… @url",1
@user монгольское приложение,1
"@user @user по-вашему, должны ли дети называть друг друга грязными арабами или грязными белыми? забавное образование",1
слишком много внимания уделяется медицинской стороне с хозяевами,0
"и... еще несколько клипов, на которых мне нужно уделить больше внимания. Икс)",0
"@user @user точно так же, как терроризм, потому что ислам — это религия, которая выступает за мир. Пророк саллах… @url",0
тебе не нравятся девушки Ренуа? — ну почему они мне не нравятся? @url,1
"@user ха-ха-ха, но в то же время цисфобии не существует, поэтому он никогда по-настоящему не поймет, что это такое?",0
Новое эльдорадо rebeus c plus mtn Trading — это аэропорт,1
@user @user полностью согласен на призыв! пока он задерживается на темной стороне знака… @url,0
"@user @user исследователь, возглавляющий это исследование, о котором вы, вероятно, не читали, очень точен... @url",0
Откуда приезжает большинство #беженцев? две трети беженцев происходят всего из пяти стран:… @url,0
"@user @user, так что на самом деле, чтобы защитить виды животных, вы обрекаете их на вымирание... @url",0
"@user @user @user штуку в очках однажды подберут мигранты, и она заплачет. Фрэн… @url",0
"rt @user @user @user zohra madame — левый ислам, они смеются только над порабощенными белыми людьми и зимми",0
"так что на самом деле они еще не легализовали аборты, это остается табуированной темой. с другой стороны, мы учимся уже 4 года… @url",0
"к счастью, у меня есть итальянская сторона, которая спасает повстанцев между нами, это слишком серьезно @url",1
"@user @user, на мой вкус, слишком много насилия",0
"Я не левый, но он на 100% прав. это неприемлемо @user рыбе нужно больше @url",0
миграция 59 в пользу мигрантов из Кале @url через @user,1
@user @user @user и вы против ПМА для всех и против абортов. эль… @url,0
"Ренуа оскорбляют вас, чтобы вы упали посреди дорожки для боулинга",1
в любом случае свадьбы в Ренне действительно лучшие,0
"уже куда вы позволяете себе приходить лечиться? и поэтому я предпочитаю Ренуа, в чем твоя проблема? это интер… @url",0
"ты видишь друзей из Ренна на ребе — лол, что это значит, что это все равно большой @url",0
"@user, если ты можешь объяснить мне, что такое крайне правые, без банальностей и левой пропаганды, которая мне...интересна",0
@user @user @user арабы ничего не заимствовали у индейцев в 9 веке!!!,0
"те, кто против абортов, это те же люди, которые за смертную казнь",1
"@user грязный араб, хватит вторгаться в наши страны, насиловать наших дочерей и воровать нашу работу!",1
@user @user интеллектуальный терроризм здесь значил бы: «деколониальное определение расизма исключено… @url,0
"Мне нравится видеть, как EternalFreedom так быстро защищает палестинцев вместе со своими друзьями из Ребеуса и чувствует себя хорошо… @url",0
Это я дебил! Я упал !,1
