post,label
"@user и подарите это врачам-гинекологам, которые против абортов, с лозунгом «вы хотите… @url»",0
"в 2018 году в Швейцарии (и вообще везде, если на то пошло) все еще есть люди, выступающие против права на аборт… @url",0
@user настоятельно рекомендует нам сосредоточиться на специалистах по водному поло и клюшке. это две великие страсти… @url,0
"@user, если бы ты сделал такие обобщения о Ренуа, это бы назвали дискриминацией, а ты… @url",0
"во Франции просит военных беженцев, изгнанных во время геноцида в Руанде, «французизировать» свои имена и фамилии… @url",0
"лол ренуа, который ничего не говорит 69, как вам не стыдно",0
"@user повстанцы, ты трахаешь их сестер, они в замешательстве",1
"@user @user @user @user Я совершенно не прочитал то, что вы сказали, и собираюсь потратить время на д… @url",0
"блин, но какой монгольский @url",1
"@user Я поддерживаю тебя, grv, откровенно говоря, сила говорит с тобой о ребе и арабах, но сам по себе ты… @url",0
@user @user играет словами. Французская колониальная история делает нас арабами и… @url,0
"ну, пункт совести врачей, особенно против абортов, — это право вето Людовика XVI. я… @url",0
"@user сообщает поздно, но такие воскресные дни заслуживают внимания. очень красивая фотография !",0
@user поздравляю с 35-летием моего любимого левого ^^!,0
"вторжение, которое мы переживаем, заключается в том, что из туристов этот человек - левый историк @url",0
"@user @user ах, левый... любовь к дебатам, интеллектуальная честность! :) @url",0
"Простое наблюдение: Европа подвергается вторжению, оккупации, исламизации и великой замене. пароль… @url",0
"@user, ваш ответ здесь =i> преданный писатель и блоггер. в освобожденном - феминистская борьба должна быть выиграна… @url",0
"@user @user непсихофобия – это когда клеймят психические заболевания: говорят, что кто-то умственно отсталый… @url",0
@user @user Возвращаю Вам совет о достоверности информации. В насилии каких-либо… @url не сомневаюсь.,0
#Гватемала: сторонникам расширения #абортов пришлось принять решение снять статью из предложения… @url,0
@user @user это хорошо известно,0
Париж: 16-го числа откроется центр размещения беженцев @url via @user… @url,0
"Кажется, приятно не быть грязным арабом @url",0
"@user Я бы хотел, чтобы мы сосредоточились на твоей голове, это просто великолепно",0
@user @user ренн ....левый город с 1977 года без перерыва,0
"@user, боже мой, я не был к этому готов @url",0
между Вальсом и Мексикой Франция теряет..... на самом деле не так много. Изгнать беженцев мы можем. @url,1
@user /o Я не знаю. Я не понимаю. У меня это было до сих пор. собирается снова принять все это насилие обратно в лицо. #усталость,0
"@user Я советую Фрэнсису Валлату, чтобы каждый член его ассоциации приветствовал мигранта в своем доме. мы… @url",0
"@user @user ps но она усвоила все, что говорила, говорила по-русски, пусть идет ps мимо… @url",0
"@user @user Когда я был ребенком, мой лучший друг был евреем. Я узнал об этом только тогда, когда об этом упомянул житель Северной Африки… @url",0
@user @user @user спасибо за подтверждение моих слов,0
@user @user как ты смеешь писать такие вещи? так что в основном об этом просят арабы… @url,0
@user @user но это никоим образом не оправдывает оскорбления или притеснения,0
"Арабские ежедневные газеты на суданском арабском языке, вторник, 25 сентября 2018 г. @url",0
нежная и цивилизованная любовь Rebeus JVS,0
"@user Я умер в детстве, даже если в их головах есть какие-то единичные случаи, как только встретишь на улице повстанцев, сразу получишь… @url",0
"@user вау, я собираюсь разбить тебя, джиджи, ты так говоришь, ты, который любит насилие, сломай тебе большую картошку, иди",1
@user и вице-президент занимаются этим с 1930 года; «мы совершили войну»; но не зацикливайтесь на роли… @url,0
"@user, это все равно грязные арабы, я все равно хочу дать им пощечину",1
Лично я бы приветствовал одного мигранта на каждого депортированного Ника Конрада.,1
@user всегда ты заходишь слишком далеко,0
"МБЗ во главе Объединенных Арабских Эмиратов средств. mubadala, его впечатляющий фонд национального благосостояния и множество… @url",0
"Европа — это не меню à la carte, запускает Макрона в страны, которые отказываются принимать мигрантов @url",1
@user за или против абортов?,0
волны ренуафобии меня пугают,1
"за открытие порта Ниццы для «Водолея» и лодок, доставляющих помощь беженцам",0
"@user если арабы говорят тебе, что мы виноваты, то это точно мы виноваты",1
"посмотрите на этих дебилов, птн не в дерьме на 2019 год... @url",0
"@user, но абсолютно точно! вы видите, насколько велико мое сердце даже по отношению к беженцам… @url",0
"@user @user ты знаешь, почему это выше? потому что завтра развлечений уже не будет... @url",0
"@user, они только думают, что ты левый и феминистка? бедные люди",0
"марокканцы спорят с монголом, который считает, что Португалия находится в Северной Америке, jsp cmt vs может удержать jlaur… @url",0
@user наконец-то я вернусь... какое насилие сегодня утром. Разве ты не выпил кофе? @url,0
(Charente Libre): #Италия принимает закон об ускоренной высылке мигрантов: Совет министров Италии… @url,0
"@user @user @user @user ? какая форма насилия? Я просто задаю вопрос, чтобы узнать, что… @url",0
"Германия: Арабские кланы создают закон. полиция решила не реагировать, чтобы с ней не обращались как с… @url",1
"@user @user тебе нравится вкус мяса плотоядного животного, вот и все.",0
@user @user @user @user @user сними шоры! насилие затрагивает и отцов… @url,0
"@user, когда появятся еще ягнята для помощи, как ты собираешься поступить с грязным арабским бородатым террористом, который кричит на всех… @url",1
@user @user @user реальная история вторжения-исламизации берберов арабами? не мечтай...,0
@user @user Я левый и вообще не признаю нас левыми... @url,0
@user Я ненавижу Алена Сораля. он манипулятивный заговорщик-антисемит-расист,0
Насилие в Триполи растёт Франция требует санкций против ополченцев | Reuters @url,0
"вчера я разговаривал с левым интеллектуалом, который сказал мне: мы должны признать, что сегодня только одна религия p @url",0
"@user @user оскорбление называет это оскорблением. в грязно-белом, грязном арабском, грязно-черном… @url",0
"@user нет, по-моему, ты не посещал карту и не гонялся за ней и все такое. ты скорее сосредоточился на при… миссиях… @url",0
"@user @user @user @user да, я мать. и никакого насилия в моем доме. никогда. насилие… @url",0
@user @user @user @user lr — левая партия. Встреча Лорана Вокье и Ангелы Меркель доказывает это.,0
"лучше, чем Тьяго Месси, все, все кончено, он крутой, лучший гитарист века, это он, он @url",0
"этот образ невыносим! после этого как мы можем еще выступать против беженцев и мер, принятых в их… @url",0
"@user Я видел ваше видео и настоятельно советую вам установить приложение @user, которое борется с киберпреследованием.",0
"@user @user, кстати. если вас действительно заботят условия жизни людей и если у вас есть п... @url",0
@user @user @user оуууин бб,0
"@user, например, вы хотите помочь делу ребеу, но боретесь со своим братом-ребеу, у которого другое мнение… @url",0
"пока вы наслаждаетесь вкусной #едой, тысячи детей и #беженцев страдают от #голода и… @url",0
"почему левые феминистки и ЛГБТ или сторонники ЛГБТ, но хотят приветствовать и интегрировать ислам во все… @url",0
"@user, о чем ты говоришь, говорю тебе, тебе не стыдно говорить «получерный», а не «полупакпак-ретард»",0
"он против абортов, когда говорит о некоторых вещах, он сказал мне, что хорошо, он предпочел бы сделать аборт, чем аборт в… @url",0
"Франция – аутистка, или глупая, или наркоманка. Я больше не могу знать. @url",0
"вопрос простой, что творится в головах некоторых ренуа я смотрю не понимаю, чего я требую… @url",0
"@user @user @user давайте не будем забывать, что многие евреи нашли убежище в Магрибе в это время… @url",0
@user Это не привлекает повстанцев,1
"@user @user @user @user ты предпочитаешь свободное насилие себе. мы предпочитаем, чтобы это закончилось… @url",0
"Перечитать рекордный бюджет | Эвакуация из-за дождя | меньше запросов, но больше беженцев @url",0
Кто хочет на неделе съездить на китайский?Очень хочу... ноич,0
@user много мигрантов также приезжает из англоязычных и других стран. существует дисбаланс между… @url,0
"@user wa fik ну, для идиотов, которые это слушают, это довольно просто: рэп=пригород=иммигранты=араб/черный=ислам=терр… @url",0
"@user лично мой взгляд все меньше и меньше задерживается на такого рода покрытиях. Я думаю, мой… @url",0
"Ренуа много обманывают, белые обманывают лучше. лол вау вау позволь мне рассказать тебе",1
"@user @user во время этих саммитов напоминают, что африканцы и индонезийцы больше не должны экс… @url",0
"Между ловушками для посылок, устроенными Сезаром Сайоком, ультраправые могут критиковать левый демократический электорат ame @url",0
"ах да, и французская пресса будет продолжать объяснять, что араб, кричащий «Аллаху Акбар» и убивающий неверующего, — это не… @url",1
"rt @user @user @user @user @user @user здравствуйте, я левак и потом просыпаюсь",1
"сравните #Холокост #евреев и #вторжение #мигрантов, которые составляют большинство #экономически… @url",1
убийство подростка: «Канадские СМИ предпочитают защищать беженцев»: @url через @user,0
Питтсбург: яд антисемитизма снова убит (pcf),1
Ежедневные строки Акрама Белкаида: споры вокруг арабских имен не являются чем-то новым под солнцем... (iht… @url,0
@user как обычно!! бедный малыш!!! в Африке нет выборов?? ты видишь… @url,0
"rt @user, когда видит кровавую бойню любимого левого радикала Мадуро Меланшона ude4c @url",1
"@user @user @user ты понимаешь? солдаты в постели, которые бьют все соседние арабские страны. уважать !",1
@user демонстранты #idleb и #aleppo являются символом мужества сопротивления и стойкости… @url,0
"@user Я уже знал ее немного раньше, но не вникал в это, и видео лол меня очень взволновало",0
"@user Я не понимаю, это ужасно. такая милая собака. Я устал от человеческого насилия. должен убить газ.",0
"@user @user Я сейчас нахожусь в Америке, учусь в старшей школе и с начала года... @url",0
"@user У меня... есть небольшая идея, но я назову себя левым...",0
"@user @user «отказать» этим мигрантам «в праве на убежище на том основании, что они будут… @url",0
#assises du gard # адвокат семьи жертвы подчеркивает чрезвычайную жестокость нападения. девяностолетний фр… @url,0
"типично для Ренуа, лол, когда они проигрывают битву, это становится скандалом! отойди @url",0
"@user Сунниты разрешают убийство, педофилию, полигамию, насилие в отношении женщин и т. д. во всех странах… @url",1
интеллект отсталого подростка!!! @url,0
"@user Я чисто берберского происхождения, у меня чисто арабское имя и фамилия! Это значит, что все надоело.",0
rt @user @user @user мдрррр. ты такой милый,0
@user @user @user @user лол старая добрая левая тактика! ответить вопросом… @url,0
"@user @user хочется плакать (правда) у тебя еще один вечер, люблю тебя",0
"@user ... терроризм — это образ действий, технический процесс, который сам по себе не несет никакой идеологии. может… @url",0
"кто такой монгол, который это делает? нет подписи... @url",1
@user @user @user почему полу? ...помощи никогда не бывает слишком много.,0
"ух, со мной только что случилось что-то безумное, я шел домой, когда передо мной двое Ренуа угрожали электрошокером… @url",0
"@user Американские евреи поддерживают Трампа, они встревожены тем, что СМИ замалчивают ненависть к… @url",0
@user эта техника предназначена только для родителей Ребеуса,0
"@user bobo islamo по-своему левая феминистка, по крайней мере, признай, что ты хороший, здравомыслящий педик ^^",0
"~не зацикливайтесь на деталях, иначе вы рискуете упустить то, что перед вами~",0
"нет-нет, скажи, что бедные левые болячки уже подчинились исламу...",1
"@user Я недостаточно долго слушаю его альбом, пойду послушаю еще раз",0
"@user @user Боюсь, это его страх, что его назовут фашистом. но это уже рассматривается… @url",0
какие дебилы @url,0
@user @user @user нет времени! правительство уже достаточно занято мигрантами из Африки и ислама!,0
"тогда фильм называется «Богемская рапсодия», но в фильме очень мало затрагивается концепция этого музыкального шедевра",0
@user @user @user Я тоже спрашиваю,0
Я левый даже в мастурбации,0
"@user Я слушаю его сегодня вечером. Я сосредоточился на том, что было на взлете, и на том, что было в метро, ​​в сотрудничестве с 21savage и Трэвисом Скоттом.",0
#lfauit @пользователь должен увидеть #mongolian,1
"@user @user @user речь идет о приеме мигрантов, как и о культуре, эти два требования… @url",0
@user @user @user назвал меня грязным арабом. грязно-белые тоже.так что не знаю где… @url,0
"@user @user каждый год от голода умирают миллионы людей, но ты хочешь, чтобы все осталось гнилым... @url",0
"@user trop negro, мы тоже не рады его найти. спасибо, автор текста",0
@user 1 монгол,0
The au «ошеломлен» комментариями Сальвини об африканских мигрантах в Европе @url @url,0
@user @user ратуша социалопе исламо-левый предатель Франции подведу итоги,0
"@user, ты приносишь нам болезнь из Иерусалима?]",1
"@user @user тебе так больно? если он предпочитает Ренуа, то это его вкус, зачем говорить плохо?",0
"@user @user это результат левой идеологии, которая во имя равных возможностей хочет г... @url",0
"@user, почему в Европе так много африканских мигрантов, если все остальные — мерзкие расисты… @url",0
когда увидит кровавую бойню любимого левого радикала Мадуро Меланшона ude4c @url,0
#pmasansfather: во имя всемогущего желания взрослых над детьми допускает насилие над их глубокой идентичностью.,0
"арабы скажут, что это глаза народа @url",1
"так что, если азиаты и Ребеус физически не привлекательны для меня, я также расист по отношению к азиатам и Ребеусу… @url",0
@user @user tg fdp грязная собака грязный еврей газ enctr,1
"@user @user говорит, что... задержка в вопросе, да простит тебя Бог, дорогой друг, да простит тебя Бог",0
"@user @user @user этот интеллектуальный терроризм просто сумасшедший! у вас, конечно, одно и то же имя, но… @url",0
"@user да, спроси, по словам Зеби, ты бы вышел грязным евреем",0
"@user @user, возможно, некоторые люди больше не могут терпеть, чтобы мы зацикливались на таких… @url",0
"чем больше образования получают дети-беженцы, тем больше они развиваются:",0
"@user да, я думаю... смелость udc99 Нил не прислал мне фотографию напрямую, у меня был такой шанс",0
"@user Я действительно не знаю, тролль ли это, но надеюсь, потому что Хэллоуин = сатана, это действительно звучит как религиозный дебил",0
"Это удаляет эту локализацию, чтобы посмотреть renois1, и потому что она локализована с помощью renois 2, так как там не так уж много глупостей… @url",1
"Я считаю, что Янн Мойкс не ошибся в вопросе насилия со стороны полиции. конечно, йена, и ладно, тебе придется… @url",0
"@user, может быть, левый? @url",0
"когда Вокье почти выставляет Филиппа левым, правым, чтобы расстроиться? #политическаямиссия",0
это травмирующее видео ритуала коалиции mr-nva было подвергнуто цензуре в Facebook за «чрезвычайное насилие»… @url,0
"и у меня чертов ларингит, как будто он кашляет, как большой идиот, и у него больше нет голоса, и он сидит на антибиотиках.",0
"независимо от того, за или против абортов, это право каждого, но никто не должен смешивать свои убеждения… @url",0
"Ренуа, у них есть гены титана, они растут 3 дня, они в наличии",1
"@user, ты более чем уважителен, остальные - гораздо меньше!",0
"@user, они те же самые, кто проповедует мораль против абортов....",1
