post,label
"@user, ты действительно веришь или повторяешь что-нибудь, что говорят в Интернете? Этот сайт является антисемитским и конспиративным!",0
"@user pq много ли повстанцев, которые сопротивляются старому?",0
Всемирный банк выделит 80 миллионов долларов для беженцев и принимающих сообществ в #Нигере.… @url,0
какой он — красивее всех бунтовщиков @url,1
@user никаких грязных негров и грязных арабов,1
"Я слишком сильно люблю тебя, чтобы бежать, когда ты смеешься, Ренуа @url",0
@user @user @user @user Это пахнет злыми левыми... конец дискуссии!,0
Первое официальное уведомление Парижа о комментариях Эрика Земмура о мусульманских мигрантах @url @url,0
вчера возобновила приседания по мне как вам сказать что ноги горят хожу как монгол,0
"@user точно xd, ты мой драгоценный друг, я много внимания уделяю таким деталям xd",0
"@user @user @user всех тех, кто говорит, что мусульмане и ислам — это терроризм, так что… @url",0
"@user islam= мир, гора, я собираюсь произнести вам еще одну речь, потому что я уже произнес одну: если есть *терроризм* во Франции… @url",0
@user @user @user @user Wallah Wallah держит цитату из Корана...,0
"ptdr он абсолютно прав, но в серьезных комментариях девушки говорят, что Ренуа тоже ставил… @url",0
@user @user Антисемитизм в наши дни исходит от крайне левых и ислама.,1
"@user, он собирается взять с собой несколько мигрантов?",0
"@user замечает фото, которое может дать чертов сценарий фильма: 4 Ренуа и их кальян Beurette",0
"@user @user он мог бы сказать это этим бедным беженцам, я так думаю",0
@user @user простой пример,0
Беженцы рохинджа молятся в лагере беженцев Кутупалонг в Бангладеш. @url,0
"@user @user @user да, но если арабы проиграли там, а не где-то еще, то это еще и потому, что мы… @url",0
"@user бедность не является залогом насилия, как и богатство. тебе нужно поискать в другом месте",0
"@user @user Теперь я пытаюсь понять. Я знаю, что когда мы говорим, что мы антисионисты... @url",0
"@user люди выросли, уделяя больше внимания этим мелочам, время меняет настоящих, чистых... @url",0
"@user Я рассмеялся, это было прекрасно xd",0
"@user @user часто арабы признают, что Франция прекрасна и что им было бы лучше без французов!",1
"@user, этот парень того же происхождения, что и ты, и ты говоришь, лол, на грязном арабском языке.",1
"@user @user @user #левый, «который #думает»: у него есть только интуитивное размышление.",0
@user и в деревне...или Макрон посадит 72 мигранта в деревню из 400 человек...и куда они пойдут... @url,1
"@user нет, левая национальная тряпка Марианна пишет статью против мехенкона, я раскрываю лелуйя!",1
@user @user спасибо,0
@некоторым не стоит думать об использовании женщины-христианки...,0
@user @user renz гангста самый красивый из всех повстанцев,0
"@user @user 2/2 второе эссе фокусируется на том факте, что в спа-центре также приветствуются и более нетипичные животные. нет… @url",0
"@user @user хм, я действительно не зацикливаюсь на «красивой девушке», а, я спрашиваю, есть ли у тебя… @url",0
"каждый день, ниггер, это пятницаууууууу",0
"Марианна Субре, шоры! только в Нанте эвакуировано и будет размещено 700 мигрантов!",0
@user ты грязный как еврей...,1
"@user, кто этот дебил?",1
"@user pcq снова нацелился на Ренуа, нет, места нет, все, что ты можешь туда попасть… @url",0
@user худшее (извините за друзей в тюрьме^^) это было насилие со стороны прессы и полиции >после<. Это д… @url,0
"@user @user, чтобы сэкономить время, отметим, что именно еврейское лобби контролирует оба:",1
"@user Сразу уточню, что я не исламо-левац и антисемитизм не отрицаю... @url",0
"@user @user вы представляете это как среднее значение, но в пищевой сети это место может варьироваться... @url",0
"@user все люди чувствуют себя мишенью! Тогда это секта? как негры, арабы, учителя...",0
Ливия: более 100 человек погибли при затоплении двух лодок с мигрантами @url,0
"@user @user спасибо за этот диалог. ты не любишь арабов, скажи это ясно. Хорошего дня.",0
"@user замените слово «национальное образование» на «ислам», слово «педофилия» на «терроризм» и слово «профессор» п… @url",1
@user @user @user никто не должен навязывать свою диету... @url,0
"@user au бесполезен, его финансирует Запад, который диктует ему поведение, кризис мигрантов, au… @url",0
"@user @user @user @user ты правда думаешь, что в Даиш всего два ренуа? Боко Харам?… @url",0
"с другой стороны, вот и все, мне не нравится, что ее отправляют в Индию делать аборт, но, брат, аборт ausis, это харам, твоя маленькая… @url",0
"эх, Ренуа пора проснуться @url",0
#европа #франция греция: поток беженцев и мигрантов на континент ускоряется @url,0
"[серия жестоких нападений: слишком много, но мало инцидентов на Корсике] (@url via… @url",1
"@user @user @user @user в мире нет ничего более ненавистного, чем ислам, религия террора… @url",0
"@user @user, так почему же эволюция означает, что у нас есть клыки, если нам суждено есть... @url",0
"@user да, это называется колонизацией и исламизацией нации с одобрения наших правительств, подчиняющихся ЕС.",0
"@user @user это место — символ борьбы с терроризмом, а не с исламом, который ничего не имеет… @url",0
чертовски умственно отсталый,0
"лол, фаллу монгол настоящий сай-сай, посмотри, какую сделку он дает хозяину... @url",1
@user так вот в чем секрет красоты и вечного счастья,1
@user @user @user понравится ли жертвам насилия насилие?,0
"Ислам – это не терроризм... Я имею в виду экстремизм, и он существует во всех… @url",0
"@user, однажды ты сказал, что тебе нравится Ренуа в Твиттере, я это очень хорошо помню, а потом даже в реальной жизни ты… @url",0
"@user @user @user этот вид, где взгляд задерживается и вызывает ласки",0
но они оплакивали серость Ренуа laaaa tema matuidi @url,0
"@user @user @user не имеет ничего общего с крайне правыми, мы должны бросить курить левым, все... @url",0
"#иммиграция #ислам, когда в Германии правят арабские кланы. такая слабость вызывает рвоту. читать. @url",1
Вопрос @user: веганы против абортов?,0
"В Женеве, да... ты думаешь, что мы здесь такие же глупые, как и ты, бедный дебил. нам придется пойти забрать с… @url",1
преступление солидарности с Седриком Эрру в его борьбе за прием и защиту африканских мигрантов в… @url,0
"когда я учился в средней школе, и мне было очень, очень плохо из-за преследований, которым я подвергался, я признался… @url",0
loon-plage: велосипедистка придумала нападение мигрантов. она просто упала с велосипеда. @url,0
"rt @user @user @user давайте набьём левых и дадим им понять, что, играя с нашими жизнями, они",0
Греция. Мигранты продолжают прибывать в Салоники! @url,0
@user @user они хотят этого от хороших маленьких домашних придурков,0
"@user, какой маневр! ну, я представлял это с немного большей жестокостью, лол, все в порядке, оно мягкое",0
"@user mdrr ну нет, ах, я правда не знаю, признаюсь, я не слишком зацикливаюсь на их профиле, хаха",0
"@user нет, родители не были бунтовщиками...",0
у арабов даже не стоит задавать вопрос @url,1
@user wauquiez — левый по сравнению с нами,0
"Если он говорит о том, что он феминист, и о правах женщин, это здорово, но почему ты пришел... @url",0
"Ренуа, его мать, они никогда не платят за такси",1
"#хдеспрос @user приходит к вам на съемку, как любой левый, желающий навязать свою речь. они делают… @url",1
@user @user последователь левых взглядов,0
Под руководством Чингисхана огромная Монгольская империя использовала развитую почтовую систему по всей империи. #uoim2,0
"@user @user и нет, преступлений, совершенных мигрантами, совершается не больше, чем белыми французами. только меньше… @url",0
"@user, они тоже заговорщики против вакцинации?",0
Глупо слишком быстро публиковать информацию из исламо-левой коносферы.,0
Остерегайтесь исламофобских комментариев со стороны левых и правых фашистов. Ислам — прекрасная религия мира и взаимопомощи… @url,1
"@user @user ты думаешь, что твое дело заранее проиграно",0
"@user @user аргумент в том, что черные и арабы заявляют, что они черные, а арабы и голуби г… @url",0
"парень черный, но он все еще говорит, что черные, да ладно, лол.",0
"@user @user так, как будто #мигранты, приехавшие из глубоко гомофобных стран, однажды станут дружелюбными к геям!",0
"@user все мои преподаватели используют правильное имя, а я даже поменял свое имя в секретариате университета",0
"@user @user @user тут нечего понимать, левый есть левый. он может рассказать всё и... @url",0
"@user, с другой стороны, я свободно говорю по-китайски и могу сказать вам, что цзин-чонг ничего не значит.",0
"что убивает, так это то, что даже несмотря на то, что ему надоел Карди Би Валла, кроме его успеха, никто не может поддержать этого большого монгола",1
"по мнению @user, полиция выполняла бы свою работу лучше, если бы среди полицейских было больше арабов и чернокожих… @url",1
"Наги про шариат, который не может не добавить немного промигрантского левого ислама, прямо пропускает это @url",0
zemmour aphatie радикальность одного интеллектуальный терроризм другого... болезнь: идеологии - жертва... @url,1
"rt @user хэштег #pasdevague наконец-то прозвучал похоронный звон по слабой левой идеологии, которая доминировала в течение многих лет",1
Африка слаборазвита,0
"@user они бежали из Испании и нашли убежище в Алжире, но когда прибыли французы, они… @url",0
"@user @user да, давайте вспомним резню в лагерях беженцев Сабра и Чатила, совершенную фал… @url",0
"Лично @user в городе, где я живу, у меня больше шансов умереть от соли, чем от терроризма!… @url",0
"@user ах да, они здесь сходят с ума от этого",0
"@user Я понимаю, почему большинство людей говорили, что я... араб, когда я вел стриминг. такое... излучение... @url",0
@user @user нет нет никакой исламизации.... это фантазии крайне правых....,0
"@user @user цитата руководителя исследования, которую вы, вероятно, не читали: это правда, что... @url",0
@user новое имя в Твиттере! но прощается с прекрасными бунтовщиками :(,0
"#habs два гола — это все хорошо, но если посмотреть на то, как котканиеми работал вчера, и на контекст… @url",0
"@user @user не имеет никакого отношения к тому, что ребеусы в этом деле короли",0
"@user @user, значит, когда ты называешь кого-то грязным арабом, это ненормально, но когда араб называет кого-то грязным белым, это нормально?!",0
обычно в Африке наши лидеры должны использовать 50% диктатуру и 50% демократию.,0
"Мне очень нравится цвет, который я покрасил в волосы, у меня такое впечатление, что мы не так много внимания уделяем лицу, это компенсирует это.",0
"@user @user вы сделали для мусульманской общины рохинджа больше, чем все арабские лидеры вместе взятые… @url",0
"более того, давайте уроки ЛГБТИ-активизма, когда вы состоите в заговорщической вечеринке, которая заигрывает с другими… @url",0
"есть ренуа, это серьезная награда, да, они вытащат вас из «да, нет, Африка заслуживает того, что с ней происходит. л… @url",0
"@user приветствует 58 мигрантов, это бесконечно, это потребует прибытия других мигрантов, и вы это прекрасно знаете… @url",0
"заткнись, большой монгол, вернись и пиши в Твиттере всякое дерьмо @url",1
"@user установил @user, пожалуйста! Я никогда не могу сказать этого достаточно. это приложение против киберпреследований.",0
"каждый день, ниггер, сегодня пятница",1
"Итак, несколько советов мигрантам, которых собираются депортировать и которые едят нутеллу @url",0
"Мюриэль Робин рассказывает о своей борьбе с домашним насилием, которое стало очевидным после роли Жака… @url",0
"больше нет террасы, больше света...беженцы в подвале в состоянии определённого беспорядка, который мы держим, несмотря на… @url",0
"вы думаете, что ребе и ренуа действительно любят друг друга?",0
"зашел в магазин Nespresso ptdr парень спросил, купил ли он кофе для отеля он увидел два Ренуа… @url",0
"новый yeezy, она воняет бабушкой, это для ренуа, для ребеусов, для членососов и тех, кто следит за модой",1
@user @user не имеет ничего общего с терроризмом или исламом!! Это сумасшедший человек расплавил кабель!,0
"@user @user @user да, я согласен, что это анти говорят о грязных деньгах или, скорее… @url",0
"rt @user 'ching chong'' это по-китайски значит ""привет"", нет?? @url",0
"@user @user Я по-прежнему скептически отношусь к очень четким решениям, если мы не полностью концентрируемся... @url",0
"@user Кале насилует мигрантов и даже нападает на жителей, которые приходят им на помощь, из-за этого жители покидают Кале",0
"@user @user говоря об африканских врачах, работающих во Франции, было бы справедливо отметить, что среди всех… @url",0
и я фокусируюсь на мелких деталях,0
"@user @user @user @user @user ну, очевидно, среди ужасов есть Ренуа… @url",0
"@используй этих детей, черт возьми, твоя шестерка ци, невероятно, как ты задерживаешься",0
"@user @user Я абсолютно не против абортов, но особенно за контрацептивы… @url",0
"@user @user спасибо вам обоим. Я только что узнал, что я антисемитский националистический теоретик заговора… @url",0
"@user, ты утомлен, так что скажи заткнись, грр, черный парень перед ним, нормальный, носит футболку, кучу фальшивых дрч",0
"@user, наконец, я говорю, что общеизвестно, что я турбо-левый. но даже тогда это всё равно… @url",0
@user @user @user @user Я левый либертарианец и не очень ортодоксальный католик... @url,0
"Асмар рассказывает мне историю о mparl, как дебил е c tro ******",0
"@user @user он расист лол, он хочет поговорить о Ренуа и плохо отзывается о женщинах Ребе",1
"@user ну да, но повстанцы, которые очень ненавидят Ренуа иен + что Ренуа я нахожу",1
@user @user @user это ты говоришь об унизительных левых взглядах. не я. у тебя это ассоциируется... @url,0
"заговорщик-антисемит и анти-Трамп... кто является автором стрельбы, в результате которой погибли одиннадцать человек... @url",0
"@user, есть также множество африканских стран, которые не находятся в состоянии войны, и которые могут их разместить. прежде чем это умрёт… @url",0
"Возможно, этот парень умственно отсталый, но то, что он говорит, на 200% правда @url",0
"@user @user @user @user если вы согласны с собой, это значит, что вы против абортов.",0
"ты немного левый, но мне нравятся твои твиты и твои ретвиты — я не знаю, что сказать @url",0
"rt @user, в классе есть девочка, она жалуется на расизм в отношении арабов, но называет азиата чин-чо",1
Я грязный араб,0
он отсталый??? @url,0
"@user marsault, когда он вернется, я ожидал бы заоблачного уровня насилия, потому что этот парень уровня… @url",0
города солидарны #сбеженцами,0
"@user @user, возможно, мне пора заняться этим",0
"@user @user @user @user @user здравствуйте, я левак и просыпаюсь... @url",0
"идея о том, что есть 1 еврейское лобби, классика крайне правых, теперь отклоняется под аватаркой лобби… @url",0
но что значит жизнь Ренуа в разлуке с этой любимой... печальная история,0
"@user В твите, подобном статье, не особо говорится о том, что может измениться, если появится европейец… @url",0
"лол, сдержанный ребеус знает, что они не волнуются @url",1
"если бы нужно было описать, какую иностранную нацистскую полицейскую армию имплантировали в центр для беженцев и пробуют тайный гипноз… @url",1
"Североафриканцы, которых привлекает Ренуа, как и ЛГБТ, обязаны требовать этого.",1
@user @user веганы против абортов?,0
"@используй сладкое и соленое, это отвратительно",0
"@user Мне действительно нужно было это услышать, спасибо, чувак!",0
@используйте свидетель отпечатка почти трехсотлетнего совокупного существования Монгольской империи и Золотой Орды.,0
rt @user логика левого #npc #npcmeme @url,0
@user @user Мне не нравится ребеус,0
