post,label
@user Я не люблю насилие,0
"@user @user городской бобо плачет, потому что 1 корова превратится в стейк на наших тарелках, он... @url",0
1 – только арабские имена.,1
обычный левый маневр: @user пытается отвлечь внимание от #nickconrad с помощью… @url,1
ты топчешь свою мать за «грязного черного араба»,1
"@user Я уже видел это в одном из твоих видео, но не обратил на это внимания, на самом деле это futbin de pes, но лучше :p",0
"@user, ты как будто сказал, что ислам = терроризм",0
"Марин Ле Пен у власти, чтобы закрыть границы, выслать всех нелегальных иммигрантов, убрать документы… @url",0
"@user @user @user, а также скажи: да здравствует национальный фронт, пока ты есть! это... @url",0
"Только в Твиттере чернокожие люди шумят, слава Аллаху, снаружи, никогда не видел, чтобы чернокожий человек говорил грязно по-арабски или наоборот, ага",1
ливерпуль ислам псж терроризм ебать насера,1
Вот что происходит сегодня в наших французских лесах: насилие в чистом виде! ...,0
"Не все Ренуа следуют его рассуждениям, не оскорбляйте его, вы зря теряете Хасанца @url",0
"отвращение отвращение отвращение. но мы должны приветствовать африканских мигрантов, даже несмотря на то, что они богаты и могут… @url",1
"rt лучший друг @user встречается с умственно отсталым ребенком, который любит снег... @url",0
"aubenas (07): демонстрация в поддержку мигрантов в эту субботу, 22 сентября 2018 года, с 9:00 на площади Плас-дю-Мар… @url",0
"мы, черные, повстанцы, хотим их всех искоренить...",1
"@user @user они подразумевают, что все левые бобо, о которых он говорит, — это все исламо-левые люди… @url",0
почему марокканцы и ренны в нидерландах всегда красивы? несправедливость @url,0
"@user феминистка, которая разговаривает с тобой в реальной жизни.",0
"@user, это не меняется только тогда, когда монгол",0
"@user @user это правда, что анчоусы побывали на Луне и изобрели миллионы технологий!",0
@user Быть левым или левым тоже не преступление.,0
@user лол лично я не задерживаюсь в следующем прямом эфире.,0
"@user, ты узнаешь, что это называется пищевой цепочкой, узнай это в школе",0
"@user @user @user если он это сделал, то только ради твоего же блага. левые знают, что для вас хорошо.",1
"@user @user левый, который предпочитает попытаться восстановить последние пути социалистов в фе… @url",0
"@user все еще на эквиваленте: пекари объясняют вам, почему они против абортов… @url",0
негры среди повстанцев за технику это мой лион @url,1
"rt @user, очень интересно, что левые заставляют загрязнителей платить за загрязнение, производимое их промышленностью.",0
"@user @user @user нет, я просто предпочитаю, чтобы ты прекратил использовать свой левый словарный запас (c… @url",0
"@user @user лев не просто ест мясо, даже если это для него самое главное. так спокойно... @url",0
"@user @user, то ваш нефранцузский текст уже ничего не понимает. потом девочкам делают депиляцию воском. э... @url",0
"@user @user ни араб, ни черный, ни мусульманин... это не может быть террористический акт, это анти... стрельба... @url",0
"вчера закончил 1 сезон Каратель. Не думаю, что когда-либо видел столько насилия в сериале или… @url",0
#мусульмане #исламизация #великаязамена… @url,1
"@user ptddrr aym напоминает вам о Ренуа, который хотел продать нам подделки. его звали Мартин ле ублюдок @url",0
"ну после этого я рад, что сделал это, я не буду делать это снова, но птрррр, какой я монгол",0
До тюрьмы общей точкой между террористами является ислам.,0
@user @user лол эти оправдания садись на поезд и приезжай У меня есть время задержаться с минус 16… @url,0
"Зизу, этот грязный араб, я его ненавижу, невозможно, чтобы он думал, что он влиятельный человек или что-то в этом роде, ты не знаешь, что за чушь… @url",1
"@user особенно прочитал документы, подписанные @user @user и Филиппом Леклерком. не задерживайся… @url",0
"Единственная разница, которую я нашел между богатым парнем и знаменитым Дексом, заключается в том, что знаменитый Декс отсталый, иначе это одно и то же дерьмо.",0
"Ренуа и Ребе, которые создают разделение между общинами, должны запереть вас в ГУЛАГе.",1
"так Наулло придет? закончил позицию несговорчивого левого, открытого для культурного разнообразия, и incap @url",0
"@user да, и он тоже не хочет исламско-африканских мигрантов!",1
"@user да, это правда... жители Лиона не расисты, им нравится, как выглядят арабы...@url",0
"к вашему сведению, кучка грязных шлюх из #ede, слово марабут — слово арабского происхождения, а марабути — это… @url",0
@user @user @user а в западных странах очень любят мясо... @url,0
"@используйте логику религиозных людей: против права на аборт, но против ПМА: «мы хотим детей… @url",0
"#lrem и левые выступают против @user, который осмеливается говорить об иммиграции как о проблеме..",0
"@user @user ты и есть раб интеллектуального терроризма, коммунизма, напавшего на меня под… @url",0
какой у тебя тип парня — les rebeus @url,0
"@user @user только по биографии этого парня видно, что он (не)покорный левый",0
"очень классично, что после левого периода восстановление происходит еще более бурно, чем период @url",0
"как будто я отправил тренировку на снимок, парень сказал, что твоя мать грязная арабка, а твой старый певец говорит о ч… @url",1
"Я только что наткнулся на аккаунт в Твиттере, это чертовски безумие, парень - дебил с метлой на голове и с @url",0
Легенда о Дароне Ренуа в коробке действительно правдива,0
Дакар: французские солдаты подрались @url @user @url,0
"@user @user @user ну что ж, если ты их презираешь, это показывает, что иначе ты бы не стал бороться против абортов.",0
"@user @user @user частичное подавление ISF (как сказал Саркози-Фийон, левая налоговая политика... @url",0
"@воспользуйся заботой ребеуса, как и мы",0
"@user, читающая это, вызывает у нее большие вопросы: алкоголь — одно из осложнений насилия над… @url",0
"@user @user @user @user существуют виды, которые не встречаются в природе и без... @url",0
"@user @user, поскольку ты не еврей, ты глупый и грязный.",1
"честно говоря, я смотрел репортажи о Ренуа, которые живут в Корее, они вообще не произносят одну и ту же речь… @url",0
@user да здравствуют повстанцы @url,0
"@user, поэтому для опоздавших - это тот, кто выносит решение, или тот, кто судит, не видя",0
"@user @user @user также может сказать, что нам полностью угрожает вторжение затопления… @url",0
": [@user @user рэпер, о котором идет речь, который, сын мигранта, имеет точно такие же права и даже льготы… @url",0
"домашнее насилие и духовные женщины: домашнее насилие – это, как правило, не… @url",0
@user @user что не читать честно,0
"«3 миллиарда человек на земле, а вы сосредоточены на ком-то, кто еще не определился» Признаюсь, один довольно хорош..",0
"не обязательно соглашаться со всем, что говорит @user, но «антисемитизм – это не просто херня… @url",0
"ptdrrrr, грязный араб @url",0
дебил Морония,0
@user @user @user это действительно позволило признать право на #аборт право на… @url,0
"@user @user @user но сейчас чертова зима, холодно!",0
"есть два Ренуа, она подошла и села рядом со мной, хотя поезд пуст, в чем проблема",0
"Я только что открыл для себя ночной режим Твиттера, я реально отсталый",1
давайте вместе бороться с насилием в наших сообществах,0
"@user @user так много идиотов не понимают, насколько опасным может быть арабо-мусульманское вторжение в Европу.",1
"чертовы бандиты из Ренуа, которые сговорились, чтобы их оскорбили на городской площади",0
и это юридические записи. мигранты приезжают дополнительно. @url,0
"@user Я вижу, что выступать против абортов — значит выступать против свободы женщин? это совершенно не связано… @url",0
"@user арабы критикуют Мессию за то, что он ведет себя слишком по-западному в своей стране о_о, если это не так… @url",0
"что такое левый бобо — парень, который расслабляется перед ежедневной газетой, который слушает «июл» только для того, чтобы выдать себя… @url",0
"@user @user @user @user ах да, правильно, я... не понял твой первый твит",0
"@user @user @user Быть мусульманином не означает пропагандировать терроризм так же, как быть католиком… @url",0
"В любом случае, это никогда не прекратится. каждый ищет для себя лучшего и всегда найдутся мигранты.… @url",0
"@user @user @user Я немного задержусь: что, если вы позволите людям создавать свои собственные про… @url",0
40 лет левой расхлябанности!!!! @url,1
"@user, короче, ffffffffff, я задержусь подольше, потому что ты будешь придерживаться своей точки зрения, а я — своей, так что до свидания",1
"@user @user посмотри на меня, это ребе другие это ренуа с другой стороны белый jsp но это серьезно зависит от девушек",0
"Мне не к кому обратиться, чтобы пожаловаться. сосед вонючий и шумный дебил в администрации… @url",1
лол это монгол #па,0
"#hapsatousy - #zemmour или прекрасная иллюстрация того, что #zemmour осуждает: истерию, диктатуру, террор… @url",1
"ляп мыльная опера (3) Кон Бендит говорит о jlm нормальный антимакроновский теоретик заговора, учитывая его троцкистскую подготовку… @url",1
"@user @user Я вегетарианец и не поддерживаю насилие, вызванное веганским движением, все должны быть свободны, пожалуйста, уважайте",0
"@user @user @user @user ах, ладно, если ты не реной или ребеу, ты не можешь дать… @url",0
когда просит левого поспорить @url,0
многие мигранты также жили нелегально в США @url,0
"@user @user согласен, левый.",0
@user Балканы все делают посредством насилия и дикости. у этих людей никогда не будет внутреннего мира… @url,1
"Журналист снова экстраполирует: «Видит это. Макрон, конечно, не задерживается из-за страха быть допрошенным на… @url",0
"Согласны ли вы с Бернаром Кушнером, который говорит, что «мы должны принимать больше мигрантов» @url",0
@user mediapart islamo - левый? Это полное название или я неправильно понял?,0
"@user jc ap jc просто старые ребе, которых я знаю, в Ренуа расистские, хотя старых в Ренуа это не волнует",0
@user @user маленькие жесты очень маленькие жесты,0
@user @user @user @user @user @user деформация левого бобо... автор... @url,0
"даже будучи левым сторонником мигрантов, я бы зевнул, читая это...",0
"@user, но все же? однажды нам придется провести социологическое исследование левого/социалистического тропизма… @url",0
"так что на самом деле это просто вышло на улицу: «Ты расист, грязный араб? » ? Гренобль потрясающий",1
"мы все знаем, что терроризм носит политический характер и не имеет ничего общего с исламом.",0
@используйте груз мигрантов с Водолея или другого заплатили 14000 евро минимум и вы макрон сорос в… @url,0
"В классе есть девочка, она жалуется на расизм в отношении арабов, но к азиатам относится как... @url",0
@user системное смешивание ислама и насилия является целью... что они используют термин терроризм... это... @url,0
"подтверждение..мигранты собираются в Ируне в испанских гимназиях, ожидая перехода во Францию ​​через… @url",0
"размытая смесь между кем-то, наполненным любовью и насилием, парадокс на пике искусства не ради красоты, а… @url",0
"@используйте теорию глубинного государства, термин, который Трамп не отрицает, заимствует многие каноны антисемитизма… @url",0
"ярый католик, пропагандирующий дикость и исламизацию Европы! его набожный католицизм… @url",1
"@user, ультрарелигиозный человек, ничего не имею против изнасилований! но против абортов!",1
когда у Ренуа нет времени на глупости...,0
"Не могу не думать, что это тот же механизм, что и с фейковым левым и провокационным аккаунтом @url.",0
@user @user @user Я видел размытие,0
"В 2018 году все еще есть люди, которые выбрасывают грязное арабское дерьмо на улицу и считают это нормальным. невежество убьет нас всех.",1
карай матеус а монгол демаис,0
Южнокорейцы не хотят мигрантов! @url через @user,1
"@user jpense он не останавливался на этом, потому что это не заинтересовало бы многих людей (jcoco, мало кто спрашивает… @url",0
"лол, это Ренуа. все церемонии перед свадьбой проходят дома @url",0
"@user @user левый морской коммандос, это грустно",0
"В ноябре в Хурделе солнце светит долго, и тюлени тоже получают от него пользу! @url",0
#Бразилия пример #фейковыхньюс #левых: это сами индейцы убивают новорожденных @url,0
"@user @user это уже лучше, чем исламизация, большая замена неизбежна, так что мы могли бы сделать это… @url",0
"«Я африканец, я вас порадую» @url",0
"Бенсебаини, какой большой монгол, он заслуживает хороших слов. #srfcpsg",1
твой мужской стиль? - чернила? Ренуа и Метис @url,0
"@user @user @user левый... следовательно, гений",0
"забавно, всегда менопауза и мужчины против абортов @url",0
"@user @user Я говорил об этом со своим сыном в 9-м классе... он говорит, что в основном это между черными и арабами... @url",0
"@user @user ах, в этом мире есть всё. нам нужны куколды с двухзначным ци ма... @url",0
"@снова используйте злых белых угнетателей, которые получают только то, что заслуживают. левый софт остался… @url",1
"@user и расизм белых по отношению к черным и арабам настолько стерт во Франции, что даже по отдельности… @url",0
"отличная демонстрация от @user, но стоит ли этому мистеру Жоффрену уделять внимание его торку… @url",0
"@user @user тем не менее надеется, что он совершит насилие над собой, забрав деньги, на которые он может потребовать… @url",0
"@user @user @user @user реальную опасность ислама представляют левые силы, я могу вам это гарантировать",0
"@user, мы арабы в Магрибе-эль-Араби, даже если западная пропаганда гибели идет полным ходом!… @url",0
"То есть вы против абортов? — нет, я за @url",0
Это слепые финские мигранты! @url,1
"@user, если хочешь знать мое мнение, терпеливый Майк должен направить всю свою любовь в форму насилия...",0
она определенно левая,1
"и никого не волнует, что мигрантов пасут как скот???? @url",0
"@user mdrrrrrr ну да, сказал мне, что у тебя много уличных прав, но спроси, есть ли приоритет для ребеу и… @url",0
"@user @user У меня есть цена в городе, но вы можете найти ее на рынке или в арабских продуктовых магазинах/магазинах эпохи Возрождения.",0
"@user @user да, я не понимаю, почему те, кто хочет принять мигрантов, не принимают… @url",0
"вот почему проблема чернокожих и арабов во Франции никогда не закончится, мы слишком разделены, пока есть… @url",0
наза монгол те по на банда ко сека сека кк бойер с…,0
"@user @user @user Я говорю с тобой по поводу протестантизма, ты говоришь, что мы смешиваем многобожие… @url",0
"@user нет диктатуре мысли, нет интеллектуальному терроризму. да, свободе выражения совести и мнений.",0
"он из тех парней, которые попадают в суд за домашнее насилие @url",0
@user @user @user добрые левые слезы,0
"@user @user @user @user они не едят свинину, потому что она убивает их... @url",0
@user @user maniaseries: «4 блока» исследуют жестокий мир берлинских кланов арабской мафии на…… @url,0
.@user выделит 80 миллионов долларов для #беженцев и принимающих сообществ в #Нигере,0
@user e r c,0
": [@user @user @user @user hossam лол иди сюда, продавец верблюдов откажет нам, наконец, ты арабский брат",0
он не задерживается в ССГ,0
"все друзья клары называют меня твоим китайским другом лол, фу, я не чувствую себя таким уж нуком????",0
"@user @user @user @user настолько простой и избитый этот левый термин, который бросается в глаза, как только… @url",0
"@пользователь. когда 16% населения являются мусульманами, процесс #исламизации становится несколько необратимым… @url",0
@user Я самый милый Ренуа в мире..,0
"@user то же самое, мне не нравится видеть людей несчастными, даже тех, кого я толком не знаю, я всегда задерживаюсь… @url",0
